<?xml version="1.0" encoding="UTF-8"?>
<!DOCTYPE index PUBLIC "-//CHEMSTRUCT//DTD Index 1.0//EN" "index.dtd">
<index>
  <title xml:lang="en">Ethers</title>
  <title xml:lang="de">Ether</title>
  <title xml:lang="es">Éters</title>
  <title xml:lang="fr">Ethers</title>
  <title xml:lang="nl">Ethers</title>
  <title xml:lang="tw">Ethers 醚類</title>
  <entry id="CS_1_4-dioxane">
    <name xml:lang="en">1,4-Dioxane</name>
    <name xml:lang="fr">1,4-Dioxane</name>
    <name xml:lang="tw">1,4-Dioxane 1,4-二氧六環/二氧陸圜/二氧化二伸乙基</name>
    <filename>1_4-dioxane</filename>
    <authors>Jerome Pansanel</authors>
    <date>2006-05-10</date>
  </entry>
  <entry id="CS_1-propoxypropane">
    <name xml:lang="en">Dipropylether</name>
    <name xml:lang="fr">Dipropyléther</name>
    <name xml:lang="tw">Dipropylether 二丙醚</name>
    <filename>dipropylether</filename>
    <synonym xml:lang="en">1-Propoxypropane</synonym>
    <synonym xml:lang="en">n-Propylether</synonym>
    <synonym xml:lang="fr">1-Propoxypropane</synonym>
    <synonym xml:lang="fr">n-Propyléther</synonym>
    <synonym xml:lang="tw">1-Propoxypropane 1-丙氧丙烷/二丙醚</synonym>
    <synonym xml:lang="tw">n-Propylether 正-二丙醚</synonym>
    <authors>Jerome Pansanel</authors>
    <date>2006-05-10</date>
  </entry>
  <entry id="CS_2-methyl-2-tert-butoxypropane">
    <name xml:lang="en">Di-tert-butylether</name>
    <name xml:lang="fr">Di-tert-butyléther</name>
    <name xml:lang="tw">Di-tert-butylether 二-第三丁醚</name>
    <filename>di-tert-butylether</filename>
    <synonym xml:lang="en">2-Methyl-2-tert-butoxypropane</synonym>
    <synonym xml:lang="fr">2-Méthyl-2-tert-butoxypropane</synonym>
    <synonym xml:lang="tw">2-Methyl-2-tert-butoxypropane 2-甲基-2-第三丁基醚</synonym>

    <authors>Jerome Pansanel</authors>
    <date>2006-05-10</date>
  </entry>
  <entry id="CS_1-butoxybutane">
    <name xml:lang="en">Dibutylether</name>
    <name xml:lang="fr">Dibutyléther</name>
    <name xml:lang="tw">Dibutylether 二丁醚</name>
    <filename>dibutylether</filename>
    <synonym xml:lang="en">1-Butoxybutane</synonym>
    <synonym xml:lang="fr">1-Butoxybutane</synonym>
    <synonym xml:lang="tw">1-Butoxybutane 1-丁基醚</synonym>
    <authors>Jerome Pansanel</authors>
    <date>2006-06-26</date>
  </entry>
  <entry id="CS_2-propan-2-yloxypropane">
    <name xml:lang="en">Diisopropylether</name>
    <name xml:lang="fr">Diisopropyléther</name>
    <name xml:lang="tw">Diisopropylether 二異丙醚</name>
    <filename>diisopropylether</filename>
    <synonym xml:lang="en">2-Propan-2-yloxypropane</synonym>
    <synonym xml:lang="fr">2-Propan-2-yloxypropane</synonym>
    <synonym xml:lang="tw">2-Propan-2-yloxypropane 二異丙醚</synonym>
    <authors>Jerome Pansanel</authors>
    <date>2006-05-10</date>
  </entry>
  <entry id="CS_ethoxyethane">
    <name xml:lang="en">Diethylether</name>
    <name xml:lang="fr">Diéthyléther</name>
    <name xml:lang="tw">Diethylether 二乙醚</name>
    <filename>diethylether</filename>
    <synonym xml:lang="en">Ethoxyethane</synonym>
    <synonym xml:lang="en">Ether</synonym>
    <synonym xml:lang="fr">Ethoxyéthane</synonym>
    <synonym xml:lang="fr">Ether</synonym>
    <synonym xml:lang="tw">Ethoxyethane 二乙醚</synonym>
    <synonym xml:lang="tw">Ether 醚</synonym>
    <authors>Jerome Pansanel</authors>
    <date>2006-05-10</date>
  </entry>
  <entry id="CS_furan">
    <name xml:lang="en">Furan</name>
    <name xml:lang="fr">Furane</name>
    <name xml:lang="tw">Furan 呋喃</name>
    <filename>furan</filename>
    <authors>Jerome Pansanel</authors>
    <date>2006-05-10</date>
  </entry>
  <entry id="CS_methoxyethane">
    <name xml:lang="en">Ethylmethylether</name>
    <name xml:lang="fr">Ethylméthyléther</name>
    <name xml:lang="tw">Ethylmethylether 甲乙醚</name>
    <filename>ethylmethylether</filename>
    <synonym xml:lang="en">Methoxyethane</synonym>
    <synonym xml:lang="fr">Méthoxyéthane</synonym>
    <synonym xml:lang="tw">Methoxyethane 甲乙醚</synonym>
    <authors>Jerome Pansanel</authors>
    <date>2006-05-10</date>
  </entry>
  <entry id="CS_methoxymethane">
    <name xml:lang="en">Dimethylether</name>
    <name xml:lang="fr">Diméthyléther</name>
    <name xml:lang="tw">Dimethylether 二甲醚</name>
    <filename>dimethylether</filename>
    <synonym xml:lang="en">Methoxymethane</synonym>
    <synonym xml:lang="fr">Méthoxyméthane</synonym>
    <synonym xml:lang="tw">Methoxymethane 二甲醚</synonym>
    <authors>Jerome Pansanel</authors>
    <date>2006-05-10</date>
  </entry>
  <entry id="CS_oxacyclopentane">
    <name xml:lang="en">Tetrahydrofuran</name>
    <name xml:lang="fr">Tétrahydrofurane</name>
    <name xml:lang="tw">Tetrahydrofuran 四氫呋喃 (縮寫為 THF)</name>
    <filename>tetrahydrofuran</filename>
    <synonym xml:lang="en">Oxacyclopentane</synonym>
    <synonym xml:lang="en">Oxolane</synonym>
    <synonym xml:lang="fr">Oxacyclopentane</synonym>
    <synonym xml:lang="fr">Oxolane</synonym>
    <synonym xml:lang="tw">Oxacyclopentane 四氫呋喃/氧雜環戊烷</synonym>
    <synonym xml:lang="tw">Oxolane 四氫呋喃/氧雜環戊烷</synonym>
    <authors>Jerome Pansanel</authors>
    <date>2006-05-10</date>
  </entry>
  <entry id="CS_2_3-dimethyloxepin">
    <name xml:lang="en">2,3-Dimethyloxepin</name>
    <name xml:lang="fr">2,3-Diméthyloxépine</name>
    <name xml:lang="tw">2,3-Dimethyloxepin 暫譯為: 2,3-二甲基一氧柒圜/二甲基七員環醚</name>
    <filename>2_3-dimethyloxepin</filename>
    <authors>Jerome Pansanel</authors>
    <date>2006-07-13</date>
  </entry>
  <entry id="CS_2_7-dimethyloxepin">
    <name xml:lang="en">2,7-Dimethyloxepin</name>
    <name xml:lang="fr">2,7-Diméthyloxépine</name>
    <name xml:lang="tw">2,7-Dimethyloxepin 暫譯為: 2,7-二甲基一氧柒圜/二甲基七員環醚</name>
    <filename>2_7-dimethyloxepin</filename>
    <authors>Jerome Pansanel</authors>
    <date>2006-07-13</date>
  </entry>
  <entry id="CS_oxepin">
    <name xml:lang="en">Oxepin</name>
    <name xml:lang="fr">Oxépine</name>
    <name xml:lang="tw">Oxepin 暫譯為: 一氧柒圜/七員環醚</name>
    <filename>oxepin</filename>
    <authors>Jerome Pansanel</authors>
    <date>2006-07-31</date>
  </entry>
  <entry id="CS_R-2-ethoxybutane">
    <name xml:lang="en">(R)-2-Ethoxybutane</name>
    <name xml:lang="fr">(R)-2-Ethoxybutane</name>
    <name xml:lang="tw">(R)-2-Ethoxybutane (R)-2-乙氧基丁烷</name>
    <filename>R-2-ethoxybutane</filename>
    <authors>Jerome Pansanel</authors>
    <date>2006-11-09</date>
  </entry>
  <entry id="CS_1_4_7_10_13_16-hexaoxacyclooctadecane">
    <name xml:lang="en">1,4,7,10,13,16-Hexaoxacyclooctadecane</name>
    <name xml:lang="fr">1,4,7,10,13,16-Hexaoxacyclooctadécane</name>
    <name xml:lang="tw">1,4,7,10,13,16-Hexaoxacyclooctadecane 1,4,7,10,13,16-六氧環十八烷</name>
    <filename>1_4_7_10_13_16-hexaoxacyclooctadecane</filename>
    <synonym xml:lang="en">18-Crown-6 ether</synonym>
    <synonym xml:lang="fr">Ether 18-couronne-6</synonym>
    <synonym xml:lang="tw">18-Crown-6 ether 冠狀環醚 18-Crown-6 (18 員環, 6 個氧)</synonym>
    <authors>Jerome Pansanel</authors>
    <date>2006-11-22</date>
  </entry>
  <entry id="CS_2-2-hydroxyethoxy_ethanol">
    <name xml:lang="en">2-(2-Hydroxyethoxy)ethanol</name>
    <name xml:lang="fr">2-(2-Hydroxyéthoxy)éthanol</name>
    <name xml:lang="tw">2-(2-Hydroxyethoxy)ethanol 2-(2-羥基乙氧基)乙醇</name>
    <filename>2-2-hydroxyethoxy_ethanol</filename>
    <synonym xml:lang="en">Diethylene glycol</synonym>
    <synonym xml:lang="fr">Diéthylène glycol</synonym>
    <synonym xml:lang="tw">Diethylene glycol 二乙二醇/二甘醇</synonym>
    <authors>Jerome Pansanel</authors>
    <date>2006-11-22</date>
  </entry>
  <entry id="CS_tetrahydropyran">
    <name xml:lang="en">Tetrahydropyran</name>
    <name xml:lang="fr">Tétrahydropyrane</name>
    <name xml:lang="tw">Tetrahydropyran 四氫吡喃</name>
    <filename>tetrahydropyran</filename>
    <synonym xml:lang="en">Oxane</synonym>
    <synonym xml:lang="en">Oxacyclohexane</synonym>
    <synonym xml:lang="fr">Oxane</synonym>
    <synonym xml:lang="fr">Oxacyclohexane</synonym>
    <synonym xml:lang="tw">Oxane 暫譯: 氧烷</synonym>
    <synonym xml:lang="tw">Oxacyclohexane 暫譯: 氧環己烷</synonym>
    <authors>Jerome Pansanel</authors>
    <date>2009-07-06</date>
  </entry>
</index>
