<?xml version="1.0" encoding="UTF-8"?>
<!DOCTYPE index PUBLIC "-//CHEMSTRUCT//DTD Index 1.0//EN" "index.dtd">
<index>
  <title xml:lang="en">Thioethers</title>
  <title xml:lang="de">Thioether</title>
  <title xml:lang="es">Tioéters</title>
  <title xml:lang="fr">Thioéthers</title>
  <title xml:lang="nl">Thioethers</title>
  <title xml:lang="tw">Thioethers 硫醚類</title>
  <entry id="CS_thiepin">
    <name xml:lang="en">Thiepin</name>
    <name xml:lang="fr">Thiépine</name>
    <name xml:lang="tw">Thiepin 暫譯為: 一硫柒圜 (含硫雜環)</name>
    <filename>thiepin</filename>
    <authors>Jerome Pansanel</authors>
    <date>2006-07-31</date>
  </entry>
  <entry id="CS_thiophene">
    <name xml:lang="en">Thiophene</name>
    <name xml:lang="fr">Thiophène</name>
    <name xml:lang="tw">Thiophene 噻吩/一硫二烯伍圜</name>
    <filename>thiophene</filename>
    <authors>Jerome Pansanel</authors>
    <date>2006-07-31</date>
  </entry>
</index>
