<?xml version="1.0" encoding="UTF-8"?>
<!DOCTYPE index PUBLIC "-//CHEMSTRUCT//DTD Index 1.0//EN" "index.dtd">
<index>
  <title xml:lang="en">Drugs</title>
  <title xml:lang="fr">Drogues</title>
  <title xml:lang="de">Drogen</title>
  <entry id="CS_4-acetamidophenyl_2-hydroxybenzoate">
    <name xml:lang="en">(4-Acetamidophenyl) 2-hydroxybenzoate</name>
    <filename>4-acetamidophenyl_2-hydroxybenzoate</filename>
    <synonym xml:lang="en">Acetaminosalol</synonym>
    <authors>Jerome Pansanel</authors>
    <date>2006-11-09</date>
  </entry>
  <entry id="CS_N-4-hydroxyphenyl_acetamide">
    <name xml:lang="en">N-(4-Hydroxyphenyl)acetamide</name>
    <filename>N-4-hydroxyphenyl_acetamide</filename>
    <synonym xml:lang="en">Acetaminophen</synonym>
    <synonym xml:lang="en">Paracetamol</synonym>
    <authors>Jerome Pansanel</authors>
    <date>2006-11-09</date>
  </entry>
  <entry id="CS_acepromazine">
    <name xml:lang="en">Acepromazine</name>
    <filename>acepromazine</filename>
    <synonym xml:lang="en">Acetylpromazine</synonym>
    <authors>Jerome Pansanel</authors>
    <date>2006-11-09</date>
  </entry>
  <entry id="CS_2S-1-phenylpropan-2-amine">
    <name xml:lang="en">(2S)-1-Phenylpropan-2-amine</name>
    <filename>2S-1-phenylpropan-2-amine</filename>
    <synonym xml:lang="en">Dextroamphetamine</synonym>
    <synonym xml:lang="en">D-Amphetamine</synonym>
    <synonym xml:lang="fr">Dextroamphétamine</synonym>
    <synonym xml:lang="fr">D-Amphétamine</synonym>
    <authors>Jerome Pansanel</authors>
    <date>2006-11-24</date>
  </entry>
</index>
