<?xml version="1.0" encoding="UTF-8"?>
<!DOCTYPE index PUBLIC "-//CHEMSTRUCT//DTD Index 1.0//EN" "index.dtd">
<index>
  <title xml:lang="en">Nucleobases</title>
  <title xml:lang="de">Nukleobasen</title>
  <title xml:lang="es">Nucleobases</title>
  <title xml:lang="fr">Bases nucléiques</title>
  <title xml:lang="nl">Nucleotiden</title>
  <title xml:lang="tw">Nucleobases 鹼基/核鹼基</title>
  <entry id="CS_1H-pyrimidine-2_4-dione">
    <name xml:lang="en">Uracil</name>
    <name xml:lang="de">Uracil</name>
    <name xml:lang="fr">Uracile</name>
    <name xml:lang="tw">Uracil 尿嘧啶</name>
    <filename>uracil</filename>
    <synonym xml:lang="en">1H-Pyrimidine-2,4-dione</synonym>
    <synonym xml:lang="fr">1H-Pyrimidine-2,4-dione</synonym>
    <synonym xml:lang="tw">1H-Pyrimidine-2,4-dione 1氫-嘧啶-2, 4-二酮</synonym>
    <abbrev>U</abbrev>
    <authors>Jerome Pansanel</authors>
    <date>2006-09-28</date>
  </entry>
  <entry id="CS_2-amino-3_7-dihydropurin-6-one">
    <name xml:lang="en">Guanine</name>
    <name xml:lang="de">Guanin</name>
    <name xml:lang="es">Guanina</name>
    <name xml:lang="fr">Guanine</name>
    <name xml:lang="tw">Guanine 鳥嘌呤</name>
    <filename>guanine</filename>
    <synonym xml:lang="en">2-Amino-3,7-dihydropurin-6-one</synonym>
    <synonym xml:lang="fr">2-Amino-3,7-dihydropurin-6-one</synonym>
    <synonym xml:lang="tw">2-Amino-3,7-dihydropurin-6-one 2-胺基-3, 7-二氫嘌呤-6-酮</synonym>
    <abbrev>G</abbrev>
    <authors>Jerome Pansanel</authors>
    <date>2006-09-28</date>
  </entry>
  <entry id="CS_4-amino-3H-pyrimidin-2-one">
    <name xml:lang="en">Cytosine</name>
    <name xml:lang="de">Cytosin</name>
    <name xml:lang="es">Cytosina</name>
    <name xml:lang="fr">Cytosine</name>
    <name xml:lang="tw">Cytosine 胞嘧啶</name>
    <filename>cytosine</filename>
    <synonym xml:lang="en">4-Amino-3H-pyrimidin-2-one</synonym>
    <synonym xml:lang="fr">4-Amino-3H-pyrimidin-2-one</synonym>
    <synonym xml:lang="fr">C</synonym>
  <synonym xml:lang="tw">4-Amino-3H-pyrimidin-2-one 4-胺基-3氫-嘧啶-2-酮</synonym>
    <authors>Jerome Pansanel</authors>
    <date>2006-09-28</date>
  </entry>
  <entry id="CS_5-methyl-1H-pyrimidine-2_4-dione">
    <name xml:lang="en">Thymine</name>
    <name xml:lang="de">Thymine</name>
    <name xml:lang="fr">Thymine</name>
    <name xml:lang="tw">Thymine 胸嘧啶</name>
    <filename>thymine</filename>
    <synonym xml:lang="en">5-Methyl-1H-pyrimidine-2,4-dione</synonym>
    <synonym xml:lang="fr">5-Methyl-1H-pyrimidine-2,4-dione</synonym>
    <synonym xml:lang="tw">5-Methyl-1H-pyrimidine-2,4-dione 5-甲基-1氫-嘧啶-2, 4-二酮</synonym>
    <abbrev>T</abbrev>
    <authors>Jerome Pansanel</authors>
    <date>2006-09-28</date>
  </entry>
  <entry id="CS_7H-purin-6-amine">
    <name xml:lang="en">Adenine</name>
    <name xml:lang="de">Adenin</name>
    <name xml:lang="es">Adenina</name>
    <name xml:lang="fr">Adénine</name>
    <name xml:lang="tw">Adenine 腺嘌呤</name>
    <filename>adenine</filename>
    <synonym xml:lang="en">7H-Purin-6-amine</synonym>
    <synonym xml:lang="fr">7H-Purin-6-amine</synonym>
    <synonym xml:lang="tw">7H-Purin-6-amine 7氫-嘌呤-6-胺</synonym>
    <abbrev>A</abbrev>
    <authors>Jerome Pansanel</authors>
    <date>2006-09-28</date>
  </entry>
</index>
