<?xml version="1.0" encoding="UTF-8"?>
<!DOCTYPE index PUBLIC "-//CHEMSTRUCT//DTD Index 1.0//EN" "index.dtd">
<index>
  <title xml:lang="en">Sulfones</title>
  <title xml:lang="fr">Sulfones</title>
  <title xml:lang="de">Sulfone</title>
  <entry id="CS_4-methylbenzenesulfonic_acid">
    <name xml:lang="en">4-Methylbenzenesulfonic acid</name>
    <filename>4-methylbenzenesulfonic_acid</filename>
    <synonym xml:lang="en">p-Toluenesulfonic acid</synonym>
    <synonym xml:lang="en">PTSA</synonym>
    <authors>Jerome Pansanel</authors>
    <date>2006-11-22</date>
  </entry>
  <entry id="CS_benzenesulfonic_acid">
    <name xml:lang="en">Benzenesulfonic acid</name>
    <filename>benzenesulfonic_acid</filename>
    <synonym xml:lang="en"></synonym>
    <authors>Jerome Pansanel</authors>
    <date>2006-11-22</date>
  </entry>
  <entry id="CS_methanesulfonic_acid">
    <name xml:lang="en">Methanesulfonic acid</name>
    <filename>methanesulfonic_acid</filename>
    <synonym xml:lang="en">Methylsulfonic acid</synonym>
    <synonym xml:lang="en">MSA</synonym>
    <authors>Jerome Pansanel</authors>
    <date>2006-11-22</date>
  </entry>
</index>
